{
  "schemaVersion": "packproof.program.v1",
  "evidenceClass": "synthetic",
  "period": {
    "start": "2026-09-01T00:00:00.000Z",
    "end": "2026-09-08T00:00:00.000Z",
    "asOf": "2026-09-08T00:00:00.000Z"
  },
  "costPeriod": {
    "start": "2026-08-01T00:00:00.000Z",
    "end": "2026-09-01T00:00:00.000Z"
  },
  "billingReconciliation": {
    "status": "unreconciled",
    "sourceRef": null,
    "unexplainedDifferenceMinor": null
  },
  "currency": "USD",
  "merchants": [],
  "orders": [],
  "uploadIntents": [],
  "reviewerTasks": [],
  "effortTasks": [],
  "support": [],
  "costs": [],
  "payments": []
}
